Company Name,Job Title,Salary Range,Tags,Posted Before
Anchorage Digital,"Member of Technical Staff, Backend Engineering",$65k - $180k,backend,12d
Anchorage Digital,"Client Experience Team Manager, Partnerships",$26k - $140k,sales:non tech,13d
Anchorage Digital,Sales Analyst,,analyst:sales:non tech,14d
Anchorage Digital,Member of Design Team - UX Writer - Portugal,$50k - $150k,design:non tech,1mo
Anchorage Digital,Member of Design Team - UX Writer - US,$50k - $135k,design:non tech:remote,1mo
Anchorage Digital,Product Manager - BSA/AML Compliance,,compliance:product manager:non tech:remote,1mo
Anchorage Digital,"Member of Client Partnerships, Client Integrations",$29k - $108k,sales:non tech:remote,1mo
Anchorage Digital,"Member of Technical Staff, Backend Engineering (Lending)",$65k - $180k,backend:remote,2mo
Anchorage Digital,"Engineering Manager, Frontend",,executive:front end:remote,2mo
Anchorage Digital,"Engineering Manager, Data Engineering",$79k - $200k,executive:remote,2mo
Anchorage Digital,"Engineering Manager, Cryptoassets",$79k - $200k,executive:remote,2mo
Anchorage Digital,"Engineering Manager, Core Services",$79k - $200k,executive:remote,2mo
Anchorage Digital,"Engineering Manager, Mobile (IOS)",,executive:ios:mobile:remote,2mo
Anchorage Digital,"Member of Client Partnerships, Client Solutions",$29k - $108k,sales:non tech:remote,2mo
Anchorage Digital,"Engineering Manager, Cryptoassets",$70k - $180k,executive,2mo
Anchorage Digital,"Member of Design Team, Product Designer - US",$50k - $135k,design:non tech:remote,2mo
Anchorage Digital,"Member of Design Team, Senior Product Designer, Design Systems - US",$60k - $120k,design:non tech:senior:remote,2mo
Anchorage Digital,"Member of Design Team, Senior Product Designer - Portugal",$60k - $120k,design:non tech:senior,2mo
Anchorage Digital,"Member of Design Team, Senior Product Designer, Design Systems - Portugal",$60k - $120k,design:non tech:senior,2mo
Anchorage Digital,"Member of Design Team, Product Designer - Portugal",$50k - $150k,design:non tech,2mo
Anchorage Digital,"Member of Design Team, Sr. UX Researcher - US",$60k - $120k,design:non tech:senior:remote,2mo
Anchorage Digital,"Member of Design Team, Senior Product Designer - US",$60k - $120k,design:non tech:senior:remote,2mo
Anchorage Digital,"Client Operations Manager, Brokerage/Lending Operations",$60k - $200k,operations,2mo
Anchorage Digital,"Engineering Manager, Cryptoassets",$70k - $180k,executive,2mo
Anchorage Digital,Software Engineering Internship (Summer 2022),$12k - $33k,intern:entry level:dev:remote:javascript,3mo
Anchorage Digital,Member of the Technical Staff (New Grad),$60k - $150k,remote:javascript,3mo
Anchorage Digital,"Group Product Manager, Custody",$115k - $175k,product manager:non tech:remote,3mo
Anchorage Digital,Client Experience Manager,,,6mo
Anchorage Digital,"Member of Technical Staff, Backend Engineering (Cryptoassets)",$65k - $180k,backend,6mo
Anchorage Digital,Engineering Manager,$70k - $180k,executive,6mo
Anchorage Digital,Engineering Manager,$70k - $180k,executive,6mo
Anchorage Digital,Corporate Recruiter,$40k - $70k,recruiter:non tech,6mo
Anchorage Digital,University Recruiting Lead,$40k - $70k,lead:recruiter:non tech,6mo
Anchorage Digital,Senior Trader,,senior:trader,6mo
Anchorage Digital,Client Operations Associate,$60k - $200k,operations,6mo
